{
  "additional_evidence_needed": [
    "capture the NAS Attach accept or Attach reject for this UE context",
    "capture the NAS Attach complete to observe procedure completion",
    "capture the S1 Initial Context Setup exchange for this UE context",
    "obtain decrypted NAS or a capture where the inner message identity is visible"
  ],
  "ambiguous_evidence": [],
  "analysis_scope": "bounded EPS Attach procedure evidence",
  "domain": "epc-procedures",
  "domain_version": "0.1.0",
  "global_boundary_evaluation": "NOT_EVALUATED",
  "global_first_abnormal_boundary": null,
  "input_provenance": {
    "nas_eps_events": {
      "event_count": 3,
      "file": "protected-inner-nas.jsonl"
    },
    "s1ap_events": {
      "event_count": 3,
      "file": "protected-inner-s1ap.jsonl"
    }
  },
  "instance_count": 1,
  "limitations": [
    "No EPC Analysis Orchestration exists, so no global first-abnormal boundary is selected. Deviations below are procedure-local and frame-anchored."
  ],
  "model_version": "1.0.0",
  "not_confirmed": [
    "default bearer activation is not established by this analysis",
    "PDN connectivity success is not established by this analysis",
    "S1-U user-plane readiness is not established by this analysis",
    "end-to-end service success is not established by this analysis",
    "root cause and network-function blame are not established by this analysis",
    "HSS, MME, SIM or implementation behaviour is not assessed"
  ],
  "procedure": "eps-attach",
  "procedure_instances": [
    {
      "additional_evidence_needed": [
        "capture the NAS Attach accept or Attach reject for this UE context",
        "capture the NAS Attach complete to observe procedure completion",
        "capture the S1 Initial Context Setup exchange for this UE context",
        "obtain decrypted NAS or a capture where the inner message identity is visible"
      ],
      "association": {
        "basis": "pre_assignment_extension_unique_mme_identifier",
        "capture_file": "fixture.pcap",
        "enb_ue_s1ap_id": 13,
        "mme_ue_s1ap_id": 1300,
        "sctp_association": "sctp-assoc-0",
        "strength": "STRONG"
      },
      "attempt_index": 1,
      "deviations": [
        {
          "deviation_type": "PROTECTED_INNER_MESSAGE_UNAVAILABLE",
          "evidence_level": "OBSERVED",
          "evidence_refs": [
            {
              "evidence_level": "OBSERVED",
              "frame_number": 52,
              "message_type": null,
              "protocol": "NAS-EPS"
            }
          ],
          "explanation": "protected NAS envelopes carry no observable inner message identity; the inner messages are unavailable, not absent",
          "frame_number": 52,
          "limitations": [
            "ciphered inner NAS content is not decoded"
          ],
          "message_type": null,
          "observation_window": {
            "end_frame": 52,
            "start_frame": 52
          },
          "procedure_stage": "attach-decision",
          "protocol": "NAS-EPS"
        },
        {
          "deviation_type": "INSUFFICIENT_TERMINAL_EVIDENCE",
          "evidence_level": "DERIVED",
          "evidence_refs": [],
          "explanation": "no Attach accept or Attach reject was observed for this attempt; the capture does not contain a terminal decision",
          "frame_number": 52,
          "limitations": [
            "a missing message is not a failed procedure"
          ],
          "message_type": null,
          "observation_window": {
            "end_frame": 52,
            "start_frame": 50
          },
          "procedure_stage": "attach-decision",
          "protocol": "NAS-EPS"
        }
      ],
      "evidence_limitations": [
        "protected NAS envelopes prevent reading inner message identity in this attempt",
        "no terminal Attach decision was observed; the attempt is incomplete within this capture"
      ],
      "first_frame": 50,
      "last_frame": 52,
      "observations": [
        {
          "evidence_level": "OBSERVED",
          "frame_number": 50,
          "message_type": "Attach request",
          "observation_type": "ATTACH_REQUEST_OBSERVED",
          "procedure_stage": "attach-initiation",
          "protocol": "NAS-EPS"
        }
      ],
      "procedure": "eps-attach",
      "procedure_label": "EPS Attach",
      "procedure_reference": "epc-attach-c03ee12a6e",
      "stages": [
        {
          "conditional": false,
          "evidence_refs": [
            {
              "evidence_level": "OBSERVED",
              "frame_number": 50,
              "message_type": "Attach request",
              "protocol": "NAS-EPS"
            }
          ],
          "first_frame": 50,
          "last_frame": 50,
          "messages": [
            "Attach request"
          ],
          "stage_id": "attach-initiation",
          "stage_name": "Attach initiation",
          "status": "OBSERVED"
        },
        {
          "conditional": true,
          "evidence_refs": [],
          "first_frame": null,
          "last_frame": null,
          "messages": [],
          "stage_id": "identity",
          "stage_name": "Identity procedure",
          "status": "NOT_OBSERVED"
        },
        {
          "conditional": true,
          "evidence_refs": [],
          "first_frame": null,
          "last_frame": null,
          "messages": [],
          "stage_id": "authentication",
          "stage_name": "Authentication procedure",
          "status": "NOT_OBSERVED"
        },
        {
          "conditional": true,
          "evidence_refs": [
            {
              "evidence_level": "OBSERVED",
              "frame_number": 51,
              "message_type": "Security mode command",
              "protocol": "NAS-EPS"
            }
          ],
          "first_frame": 51,
          "last_frame": 51,
          "messages": [
            "Security mode command"
          ],
          "stage_id": "security-mode",
          "stage_name": "NAS security mode control",
          "status": "OBSERVED"
        },
        {
          "conditional": false,
          "evidence_refs": [],
          "first_frame": null,
          "last_frame": null,
          "messages": [],
          "stage_id": "attach-decision",
          "stage_name": "Attach decision",
          "status": "NOT_OBSERVED"
        },
        {
          "conditional": false,
          "evidence_refs": [],
          "first_frame": null,
          "last_frame": null,
          "messages": [],
          "stage_id": "attach-completion",
          "stage_name": "Attach completion",
          "status": "NOT_OBSERVED"
        },
        {
          "conditional": true,
          "evidence_refs": [],
          "first_frame": null,
          "last_frame": null,
          "messages": [],
          "stage_id": "s1-context-setup",
          "stage_name": "S1 context setup",
          "status": "NOT_OBSERVED"
        },
        {
          "conditional": false,
          "evidence_refs": [],
          "first_frame": null,
          "last_frame": null,
          "messages": [],
          "stage_id": "context-release",
          "stage_name": "UE context release",
          "status": "NOT_OBSERVED"
        }
      ]
    }
  ],
  "procedure_label": "EPS Attach",
  "stage_vocabulary": [
    "attach-initiation",
    "identity",
    "authentication",
    "security-mode",
    "attach-decision",
    "attach-completion",
    "s1-context-setup",
    "context-release"
  ],
  "unbound_evidence": []
}
